adult,child
"He jumped up and gripped my hand. ""You are right. I will put in a few",jump hand
duck duck duck duck duck .,duck duck
Hand outs  every time!,hand out
Perhaps the girl can help us.,help girl
"sing ""Night Moves"" ?",sing night
She is a girl bear.,girl bear
"Wait, just to be clear, you're saying you're opposed to cheap, meaningless, disgusting one-night stands?",wait night
the ins and outs.,in out
is that a big dog .,big dog
too big big ?,big big
in your mouth .,mouth in
um what is today today is november .,today today
yes that big head !,big head
"Just you wait, what was, shall be again and there's nothing new under the sun.",wait sun
on my hand ?,hand on
"Wait, wait!",wait wait
wait you're gonna rip them let me you're gonna have to go over her head okay let me see if i can get them off .,wait head
the spoons the spoons ?,spoon spoon
Wait 'til you see Grandma Kuchenski's dress.,wait grandma
a is for apple where's the apple one .,apple apple
So potentially two nights out of the four.,night out
IN THE NIGHT.,night in
in his chair ?,chair in
Help me... someone help,help help
"Wait, wait, wait, wait.",wait wait
what's in her box ?,box in
"A light that sings along the waves of light,",sing light
wait wait wait ?,wait wait
My dog's a big dobbo !,big dog
no more that ball's too big ?,big ball
I 'll help you to your bed for once . '',help bed
- He's on the bed.,bed on
"Wait, wait.",wait wait
"Cookie, Cookie, Cookie!",cookie cookie
"So I, I do not jump on any more.",jump more
"his fish at times. If the other spondylus fishing community, the",other fish
"Did he sing at home, your dad?",sing home
That i have never been on a blanket...,blanket on
how about the other flowers ?,other flower
"Well, he's in bed.",bed in
push push .,push push
"Girl: mommy, mommy, push me higher.",push girl
- RIGHT IN HERE.,here in
"in your bed at home.""",bed home
is she in the kitchen .,kitchen in
I ought to be on that boat.,boat on
you can push its head down .,push head
I'm just a girl who's more into... surprises.,more girl
Lights out!,light out
Big mouth.,big mouth
that her cat jumped out of the carriage ?,jump cat
your mouth hurt .,hurt mouth
"""Wait! Wait!"" came back from the Girl, unconsciously in the same tone,",wait girl
"“Ah, how that girl does jump about, dressed in my odds and ends.”",jump girl
"Wait, wait.",wait wait
here push his head down .,push head
- How was your big night with Javier?,big night
which hand is it in ?,hand in
"Wait, wait, what did he say?",wait wait
"restless—was there, waiting for him in the golden light, ready in front",wait light
right no dog on that ?,dog on
Now a pretty girl milking cows at sunrise in the meadows sounded well .,milk girl
"Out of the dark, into the light,",dark light
the fish bit you and the cowboy bit you and a big doggie bit you .,big fish
that's a big block .,big block
she must be a big girl .,big girl
this is hurting me just as much as it hurts you.,hurt hurt
"""You're a pretty girl.",pretty girl
in the bed ?,bed in
moon it's the moon book ?,moon moon
"""But it can be helped--it must be helped! Don't you see--I came",help help
what is that on this bed ?,bed on
Today's the big day!,big today
on my head ?,head on
is that light  that light.,light light
night night .,night night
"home and breeding-ground of your most splendid Navy. I was born again,",bear home
Waiting for a girl.,wait girl
more milk ?,more milk
They'll be heading out soon once they've juiced themselves up for the night.,head night
I'm totally in the dark.,dark in
Perhaps the girl can help us.,help girl
Are you on the bed?,bed on
uh in those boxes one and .,box in
you'll break the box !,break box
"- Hi, girls.",hi girl
In the kitchen please?,kitchen in
in the bed of it.”,bed in
"""Candy and Cookie""?",candy cookie
on his head .,head on
"By the moon 's light , the still penitent but now well-fed Richard beheld her looking somewhat coquettishly down upon him .",feed moon
where's the big bed ?,big bed
"Wait, wait.",wait wait
and then he jumped off of his head and onto the tree .,jump head
"Help us, please help us, please!",help help
"""I will break his teeth for him,"" said Martyanoff.",break tooth
in the kitchen .,kitchen in
The fish will be pleased.,please fish
The sun is in our eyes and in our hearts even when it's night and when it's dark.,dark sun
"No, she's in bed.",bed in
He pushed her until she broke.,push break
no more ball .,more ball
In the night,night in
"More than 1,000 bears.",more bear
"All right, wait, wait, wait.",wait wait
The moon was now up ; and they were only waiting to repose the wearied horses .,wait moon
Big night ahead?,big night
"Oh, in a box.",box in
oh she's a big girl .,big girl
no on no on .,on on
"More, more!",more more
night night .,night night
it's a big hand ?,big hand
Hands off the girl!,hand girl
` I 've waited long to shake his hand with this .,wait hand
what's on his head ?,head on
- A kick in the teeth.,kick tooth
one more box .,more box
who's that over there in the chair ?,chair in
If I just place the little piece on top like this and I do that.,unknown
And I want things done properly.,unknown
"""the reverse butterfly effect.""",unknown
"`` A sackerryfice , '' answered Demi , solemnly .",unknown
I'll have you both arrested for obstruction.,unknown
I just want you to leave it in.,unknown
Everybody loved Stacks.,unknown
"quite a long time now I  begin to understand there are M S twos and threes are project engineers, and I",unknown
It's not your lucky day.,unknown
She duplicated the jewels that don't sell...,unknown
"This elegant invitation would , I fear , have been declined , but for the hint given in the last line of the postscript .",unknown
"come to your journey's end.""",unknown
knapsacks on their backs; she is still wearing her red hat.,unknown
you don't think i'm a fit mother?,unknown
well we saw lots of different colored fish i think .,unknown
disillusionment in more senses than one; for there he saw for himself,unknown
"""I don't have any job. I quit. I was halfway through a piece of",unknown
i'm going to get you a banana laura .,unknown
I was three hours from home.,unknown
"Among other news, I told him that King Charles had sent a messenger",unknown
"face, fresh and smiling, was fair to see against the background of",unknown
I hope he don't work there still  urgh!,unknown
"His hand shook , but it was in exultation rather than in shame .",unknown
"Alright, you can put the tv in the bedroom.",unknown
"Well, it's time Ursula took matters into her own tentacles.",unknown
"-Frank, I can't go out there broke.",unknown
They had a band called Me and Him on.,unknown
About the things I want to discuss with you ...,unknown
It's only gonna get worse.,unknown
"And then what'll happen to it 20, 50 years later?",unknown
Belgium is like a button holding a shirt together.,unknown
It looks like you just wrote that today.,unknown
not too many left .,unknown
And get filthy rich doing it.,unknown
How did you get this report?,unknown
I bought dad one.,unknown
"“Oh, do look at that woman! what does she think a man can see in her!”",unknown
"approached seventeen than seventy, La Giralda caught the great man by",unknown
All your brother's favourites.,unknown
life are for the most part deliberately conscious. But so soon as we,unknown
"_space_ around her, and freedom to move the limbs: such as one does not",unknown
"Hey, John, what do you say we head back?",unknown
"If we ask them if they've been cheated by a girl... our progress will end there, since half the people would have no idea that they've been cheated, and even if they know, they will not acknowledge it.",unknown
"-- '' ` Dearest teacher , '' `` I think I will write you a letter to tell you how much I love you .",unknown
You've befriended Taylor Townsend.,unknown
"love for Telemachus, but this was always the point where we ceased to",unknown
i know that feels funny huh ?,unknown
"What, what was the reference of the urgent work one?",unknown
somebody named ursula ann ?,unknown
“What do you think Jimmie had in his mind when he went away alone?”,unknown
