adult,child
"""today, more than ever,",more today
"Please...just, just wait, don't please.",wait please
HAND BEHIND THE HEAD.,hand head
he's in a boat .,boat in
IT'S NOT MY JOB TO HELP YOU CHASE HEADLINES.,help my
Is that an apple in his hand?,apple hand
That's no more a box than you are a governess.,more box
some light on it.”,light on
You're on my boat.,boat on
"-Wait, wait, wait, wait, wait.",wait wait
"Wait, wait, wait, look.",wait wait
"Wait, wait, wait.",wait wait
she broke the flower ?,break flower
ball ball ball ball ball ball ball ball ball ball ball ball .,ball ball
"Wait, wait, wait, wait.",wait wait
on a dish .,dish on
"hand, for narrative purpose, the interest is not broken. The first time",break hand
"Hey, wait, wait, wait, I'm serious.",wait wait
on the chair ?,chair on
The big apple is for uncle Jahan.,big apple
"Now , then , when the night watch is already unarmed , and the rest are at their morning cup -- now were the time to break them . ''",break night
yeah huh where's the bear oh help elmo find his missing teddy bear .,help bear
no milk just a dish with blueberries .,milk dish
big bear lit the tiniest lantern and put it next to little bear's bed .,light bear
apple apple apple apple apple .,apple apple
yeah balls and balls .,ball ball
yes ball ball ball ball ball .,ball ball
Either she helps me get out of here or they're gonna catch me and I will not keep my mouth shut!,help mouth
in my mouth ?,mouth in
night night .,night night
"Wait, wait, wait, seriously, wait, wait, wait!",wait wait
Probably hadn't been in the sun at all!,sun in
wait wait wait wait .,wait wait
the cat jumped on the policeman's head right ?,jump cat
a big girl chair .,big girl
In light of er,light in
jump we all jump up .,jump jump
"- Sing it moodily, sing it with...",sing sing
bear bear .,bear bear
We waited all night but didn't see her come out.,wait night
I'm happy to help you if you're helping me.,help help
"lights were lit. Any one moving about after ""taps"" would surely be",light light
"Break it up, break it up!",break break
"- Hey, wait, wait, wait.",wait wait
aha night night with her bear .,night night
"Still, plenty more fish in the sea, eh?",more fish
which hand's it in ?,hand in
I've a much bigger fish to--,big fish
And dog in?,dog in
Pretty girl.,pretty girl
no more ball !,more ball
you pushed me onto the bed .,push bed
him big oh her big ?,big big
big long dog right .,big dog
the cat jumped on the man's head .,jump cat
here's some more chairs .,more chair
HOME ON LEAVE,home on
"Welcome my moon, my sun",moon sun
He waits for me to er  go to bed now.,wait bed
"- Wait Saira, wait!",wait wait
in home .,home in
ball ball ball .,ball ball
and then push it and push .,push push
in your head .,head in
bear that's brown bear right .,bear bear
"Here, on this chair.",chair on
they're in their box .,box in
The TV's broken.,break tv
"""Big pink spoon.""",big spoon
In my home.,home in
with more flowers.,more flower
can you push that ball over ?,push ball
does your tooth hurt you ?,hurt tooth
wait for me wait for me .,wait wait
"Wait, wait, wait.",wait wait
ball ball ball ball ball ball ball ball ball ball ball ball .,ball ball
That's all in your head.,head in
I wouldn't kick her out of bed on a cold night!,kick bed
in her head.,head in
"About the other night, I'm sorry.",other night
more boxes .,more box
he's in bed ?,bed in
light yeah that's the light .,light light
You do not jump and do not jump no more!,jump jump
The shyest flower that lit the grass:,light flower
Oh light helps you concentrate does it?,help light
you're in my chair .,chair in
_Sing-Sing Prison._,sing sing
I'm in bed with the girl of my dreams.,bed girl
who's that pretty girl ?,pretty girl
"Help us, someone, please help us!",help help
Hands in.,hand in
a flower and a flower ?,flower flower
oh he's in the box .,box in
"Dog Monday waits and watches there still , with just as much hope and confidence as ever .",wait dog
"OKAY, HAND IN HERE, HAND UP HERE.",hand hand
you're with other girls.,other girl
and my other hand's on your other knee ?,other hand
The dark sacred night,dark night
"`` At 'em , all hands -- all hands ! ''",hand hand
who's that over there in the chair ?,chair in
can you help me make a push saw ?,help push
My head still hurts.,hurt head
bears bears bears bears bears ?,bear bear
in the box !,box in
"- Well, I-I— Marjorie—",i i
"""Good night, very sorry I can't help you,"" he said, yawning behind his marble hand.",help night
But  today  when we finished up to the middle of th here.,finish today
"If you won't help, wait outside.",help wait
that's his other hand .,other hand
As the kitchen head.,kitchen head
night night .,night night
it's on your head .,head on
May be they waited for us ; I 'd like to ride home would n't you ? '',wait home
I'll wait on the girls.,wait girl
Right in the balls.,ball in
"- Wait, wait.",wait wait
"I'm breaking your balls a little bit, that's all.",break ball
sing what i sing ?,sing sing
I will just be in the kitchen.,kitchen in
She's always in bed by 10PM.,bed in
"- Soft hands, Jess.",soft hand
"More, more!",more more
Lights out!,light out
"Wait, wait!",wait wait
"Wait for him, wait for him.",wait wait
"Not to wait, but to wait to do it again?",wait wait
"Here, in my head.",head in
♪ Moon lights up the night ♪,light moon
jump jump ?,jump jump
'The flower girl is pretty,flower girl
a big bed and a little one .,big bed
"""and waited and waited and waited.""",wait wait
wait though before you jump down tell me .,wait jump
What about the other girls?,other girl
It's soft and light.,soft light
that's a ball and this is a ball !,ball ball
chair for the kitchen table .,chair kitchen
who is the big dog ?,big dog
What was on your hand?,hand on
badly lit at night and fuel was scarce and dear. But you were in,light night
jump jump right .,jump jump
"Wait, wait.",wait wait
On your hand?,hand on
the light or the dark green ?,dark light
with my other little ducks.,other duck
"Well, he's in bed.",bed in
And you were just on a night out?,night on
"Wait, wait.",wait wait
"""Candy and Cookie""?",candy cookie
- Night night.,night night
today was the day that katie and kit had been waiting for .,wait today
you handing me the box .,hand box
"of a dog, a dog and so on through the list, the interpretations being",dog dog
that's the on off button you push it to go on ?,push on
I'm not on the bed.,bed on
you'd be a big girl .,big girl
it's a big hand .,big hand
Now we just wait for dark.,wait dark
I'm in the kitchen.,kitchen in
- Right-I was born and he got fed up-.,bear feed
oh not in your mouth though .,mouth in
"Wait, wait, wait.",wait wait
other clock yes ?,other clock
more apple ?,more apple
In the kitchen.,kitchen in
"Yeah, but, wait, wait, wait...",wait wait
Hands on your head!,hand head
big bear's the big bear and little bear's the little bear ?,big big
where's the big bed ?,big bed
"hand at cards, hurt nobody, seemingly knew nobody.""",hurt hand
On the night of August 27th 1867 a supply train was heading westward across the prairies.,head night
too big big .,big big
Oh it's on my head.,head on
It's on the chair.,chair on
In the kitchen.,kitchen in
were you on tv ?,tv on
"Wait, wait.",wait wait
"Under us the night, and the night overhead.",night night
- How's the cat?,how cat
"On the other hand, we might be on the up-and-up with you.",other hand
where's the other ball ?,other ball
That third box is waiting for you.,wait box
One more sock.,more sock
what's in the box ?,box in
"we've finished the last, we've finished the last one.",finish finish
How long have I been in bed?,bed in
It's in a box like that.,box in
In bed!,bed in
to have kicked me out. Yet he bore with me like the sweet-blooded,kick bear
yeah not in your mouth .,mouth in
is the sock's his bed .,sock bed
Hands on your head!,hand head
he's on a boat .,boat on
the light would break .,break light
"They were awfully nice little night-lights , and one can not help wishing that they could have kept awake to see Peter ; but Wendy 's light blinked and gave such a yawn that the other two yawned also , and before they could close their mouths all the three went out .",help night
"I'm pushing, girl.",push girl
Soft in the head?,soft head
In my home!,home in
box on.,box on
it's to help the boats find out where they're going .,help boat
push chair .,push chair
I'd waited for you whole night.,wait night
"Out of the dark, into the light,",dark light
In the kitchen.,kitchen in
"Can't wait to move into a good home, Ms Bernie.",wait home
The TV's broken.,break tv
`` The night is dark .,dark night
"Me, on the other hand...",other hand
what's in this box ?,box in
closely that his hands upon the rounds of the ladder were more than once,more hand
Lights out!,light out
Big bear in there.,big bear
And hurt and hurt some more.,hurt hurt
Where are you headed in the dark of night?,head dark
Big Mouth is... is...,big mouth
in the kitchen .,kitchen in
boxes little boxes .,box box
"Wait, wait, wait.",wait wait
push push .,push push
I've a much bigger fish to...,big fish
"Wait, wait, wait, wait, wait, wait, wait.",wait wait
feed me feed me ?,feed feed
night night .,night night
what's too big your socks ?,big sock
when I was a big girl.,big girl
"for soon everything will be finished. When finished, we thread it",finish finish
The moon won't wait.,wait moon
It's just one bigger than the other.,big other
"""He broke the bread, and gave it to his disciples and said:",break bread
"What, in the dark?",dark in
in the box .,box in
Lights out!,light out
"We were waiting, so I had to take a little cat nap.",wait cat
where are your other candies ?,other candy
Girls' night.,girl night
"Wait, wait, wait.",wait wait
more apple juice my goodness .,more apple
you pushed me onto the bed !,push bed
not in your mouth .,mouth in
duck duck duck duck duck duck duck duck .,duck duck
Have you ever been in one at night?,night in
So today was our break up day.,today break
"the dark, for Lavender dared not light any of his matches. Stumbling,",light dark
"Oh, the night was dark and the night was late,",dark night
"I could n't bear it ; oh , I could n't bear it ! ''",bear bear
- Big Mouth!,big mouth
night night ?,night night
night night !,night night
"- Yeah, sun block.",sun block
Help each other.,help other
more milk or milk .,more milk
"""Pretty Jonah, pretty Jonah."" What about me?",pretty pretty
"""Candy and Cookie""?",candy cookie
in home .,home in
It's out of our hands.,hand out
"Wait up, wait up!",wait wait
which hand's it in ?,hand in
the ball is the ball's sleeping .,ball ball
Big Mouth...,big mouth
And the sun in the morning is waiting to rise,wait sun
oh in your hand ?,hand in
here's your bear blanket .,bear blanket
what's in the kitchen ?,kitchen in
"He broke the bread, gave it to his disciples and said:",break bread
A HAND IN THE DARK,hand dark
i'm on the dog again .,dog on
"Head down, head down.",head head
it's in the the other box ?,other box
I was in the light.,light in
not on your hand .,hand on
I was actually waiting for you today...,wait today
on the fish .,fish on
On her head!,head on
I'm finishing my apple and going home.,finish apple
milk milk milk milk .,milk milk
But... maybe... we could help each other out.,help other
sun that's the sun .,sun sun
"Hands behind your head, scumbag!",hand head
no milk today ?,milk today
I am the hand under the bed.,hand bed
and push savagely to force the boat along. At places they would have to,push boat
"You big, beautiful, no-longer-hypothetical boat!",big boat
A flower among the flowers at play;,flower flower
Everybody out for the blankets!,blanket out
"Thus, night in and night out the whole year round, a comparatively",night night
"""Milk them! Milk them quickly! Let me see!"" the Princess shouted,",milk milk
more clocks yeah .,more clock
`` The other hurts me . '',hurt other
"- Wait, wait, wait, don't.",wait wait
what's in this box ?,box in
hands outside and her head on the pillow—so pretty—I couldn’t help,help hand
on the chair .,chair on
You're the big fish.,big fish
I broke the dog!,break dog
night night hon .,night night
that's a big bed for a very little bear .,big bed
in the box .,box in
I'm so sorry... it's my head... hurts...,hurt head
When we had finished the dishes we smuggled our platter and tureen out of the house and went home .,finish dish
over there in your hand .,hand in
"Wait, wait.",wait wait
"The cat waited till it was quite dark, and then climbed the tree, killed the kite, and recovered the ring. ""Come along,"" it said to the dog when it reached the ground. ""We must make haste now. We have been delayed. Our master will die from grief and suspense. Come on.""",wait cat
"Big Head, 152.",big head
"A hand, just a hand.",hand hand
and cat and fish ?,cat fish
not in your mouth .,mouth in
no what's on the bed ?,bed on
If he was born on a no moon night... then we are that dark night.,bear moon
Singing above our head.,sing head
Help us help you.,help help
mhm dog and a cat .,dog cat
that's such a big bed griz .,big bed
"I broke the dog, Pheebs!",break dog
on the bed.,bed on
Some more than others.,more other
"With a home like Ingleside , and a father and mother like ours we could n't help being happy .",help home
- Big Mouth.,big mouth
light on.,light on
my bed is too big ?,big bed
"He who could jump over the boat without so much as touching it with his heel was to be the winner , and would get a large sum of money as the prize .",jump boat
"- Hi, Grandma.",hi grandma
wait wait wait they're sticking together .,wait wait
oh you kicking kick kick kick .,kick kick
cat cat cat cat cat cat cat cat cat cat cat cat cat cat cat argh !,cat cat
"“Light-boats,” 294",light boat
"That pleased the others, and they sat there a long time discussing the",please other
No-one home.,no home
"Just one more, wait.",wait more
them hand-in-hand.,hand hand
your mouth hurt .,hurt mouth
Big pink spoon.,big spoon
"If you won't help, wait outside.",help wait
"On the other hand, activity could be good for circulation.",other hand
So it's back in the box.,box in
you push his head .,push head
"I help them, I wait for them, and for what?",help wait
Should not be in bed.,bed in
no more ball .,more ball
what's on your chair ?,chair on
what is that on the bed ?,bed on
no more milk .,more milk
on this hand .,hand on
Me and my big mouth strike again.,big mouth
The bed was very soft.,soft bed
"Sometimes it was dark and sometimes light , and now they were very cold and again too warm .",dark light
in the kitchen ?,kitchen in
What about the other girls?,other girl
"After today, there will be no more water tribe, no more nations of any kind.",more today
ooh that's a very big box .,big box
- What other girls?,other girl
Big Mouth.,big mouth
It's in the kitchen.,kitchen in
because we're out of bread .,bread out
a duck duck duckie .,duck duck
wait wait wait .,wait wait
Light or dark?,dark light
It's all in your head.,head in
Like how you were born behind the clock face of Big Ben?,bear clock
I'm on break.,break on
big sun ?,big sun
"flowers upon her, and sing the funeral dirge,",sing flower
ouch okay push it hard no push it make it snap .,push push
sing oatmeal box .,sing box
"So, jump in me box, and I ain't jumping in me box blind, for the last ten years.",jump box
where's the other ball ?,other ball
"Wait, wait!",wait wait
are they in your mouth .,mouth in
Night night.,night night
She's in bed.,bed in
the other hand .,other hand
what's the big dog's name ?,big dog
"The beds, the big beds are.",big bed
One's on a break.,break on
"since that pretty head of the Andalucian beauty, for all its clustering",pretty head
“Bread of the world in mercy broken” (304),break bread
did grandma help you ?,help grandma
wow bathtub and a bed all in one .,bed in
"as he's kicking the ball, come on then, now, get in the goal, come on then",kick ball
"Pretty, pretty, pretty.",pretty pretty
wait wait wait ?,wait wait
"""Ah, but wait till to-night!"" and Alwyn's eyes sparkled",wait night
on this chair .,chair on
wait till you need some help.,wait help
sun that's the sun .,sun sun
is there a light in here .,light in
so sorry.  I simply can't help running amok to-night.,help night
"it, on the one hand with Thélème, and on the other with the fantastic",other hand
help help help ?,help help
Big head?,big head
I'll block you with my own hands.,block hand
A slightly bigger  like a fish box,big fish
"Wait, wait.",wait wait
oh oh oh wait wait come back come back ?,wait wait
blanket or no blanket .,blanket blanket
I'm just breaking your balls.,break ball
Were they in today?,today in
I did n't hurt her much ... she just cried 'cause she 's a girl .,hurt girl
out her hands toward him:,hand out
"- Hi, girls.",hi girl
"Wait, you're in my head, right?",wait head
night night carl .,night night
night night puppy .,night night
"At this we waited for no more , but shook hands with her upon the bargain , made short work of the puddings , and set forth again from Limekilns as far as to the wood .",wait hand
- Mouth on me sometimes.,mouth on
the one in your hand ?,hand in
On the head.,head on
and this ball could break that window .,break ball
"Wait, wait!",wait wait
She's a pretty girl.,pretty girl
If you can sing today... you'll be singing for the rest of your life,sing today
My balls hurt!,hurt ball
You are the moon and I am a dark night.,dark moon
i'm not finished i'm not finished .,finish finish
yeah that's a very big boat .,big boat
on the bed ?,bed on
cat cat cat cat cat cat cat cat cat cat cat cat cat cat cat !,cat cat
"Wait, wait, wait.",wait wait
What's on today?,today on
But maybe we can help each other now.,help other
It won't be long before she's heading home.,head home
It's nothing more than a blanket of silence.,more blanket
"Wait,I have been waiting for you",wait wait
now push this hand down like that and then cover him .,push hand
"indignantly, when he had finished. ""He doesn't need any more fish--he",finish fish
they're on a boat,boat on
and then you push the other one ?,push other
what else is on the dish ?,dish on
"Lisa""s broke, but she""s not afraid to ask for help.",break help
is he in the box .,box in
some more apple juice .,more apple
"Wait, wait.",wait wait
finish your uh milk first please ?,finish milk
She's more at home than she is at work.,more home
big blocks .,big block
"All right, here, to girls' night.",girl night
ball ball ball ball ball ball ball ball ball ball ball ball .,ball ball
Hands over your head!,hand head
all right the light's on ?,light on
back in that box .,box in
oh and a big bed .,big bed
You don't usually break out Big Chuck this early in the day.,break big
In your mouth?,mouth in
it's back in the box .,box in
He kicked me out of the bed every night.,kick bed
In a box?,box in
It's on my box.,box on
he has jumped out of bed on awaking and attempted to repeat it. 'I need,jump bed
not in your mouth .,mouth in
"PLEASE, I CANNOT WAIT FOR THE COURTS TO SORT THIS OUT.",wait please
"Wait, wait, wait.",wait wait
girl who's a girl .,girl girl
"head; the other a fine slim Norwegian. The German, who is a captain in",other head
it's a big boat yeah .,big boat
is he in the flowers .,flower in
"Is the, the cat  the cat back there?",cat cat
♪ Sun lights up the morning ♪,light sun
night night .,night night
we're all finished for today ?,finish today
and who is my big girl .,big girl
in the dark ?,dark in
it was on your head .,head on
I socked his head.,sock head
oh what's in this box ?,box in
i fed my cat under yonder tree !,feed cat
It's all in your head.,head in
The boat was still heading for the island .,head boat
big dog ?,big dog
milk helps you grow .,help milk
"And the other wo , and the other.",other other
You're in bed?,bed in
in the box ?,box in
a big black bear .,big bear
night night .,night night
what's that on the bed ?,bed on
What's he in the bed for then?,bed in
In '52 I...,i in
- I'm heading for the kitchen.,head kitchen
She's in bed.,bed in
You don't jump on chair arms.,jump chair
Yes in the kitchen yes.,kitchen in
- On TV?,tv on
"She was not a little girl heart-broken about him ; she was a grown woman smiling at it all , but they were wet eyed smiles .",break girl
breaking of a front tooth in sign that they are ready for marriage. They,break tooth
He he's in bed.,bed in
Wait for the dog.,wait dog
not in your mouth please .,mouth in
She's still in bed.,bed in
"Dark, and then, in the dark,",dark dark
and who's the other girl in your class with the cute blonde hair .,other girl
chair here for the kitchen table .,chair kitchen
not in your mouth .,mouth in
on the bed.,bed on
not in your mouth .,mouth in
"""He would jump the moon, master, if you asked it of him,"" was the proud",jump moon
In the kitchen?,kitchen in
I helped you bring that TV into the building the day we met.,help tv
What's that in your hand?,hand in
It's the night of nights.,night night
Kitchen... big kitchen.,big kitchen
"But you, on the other hand...",other hand
on her hand .,hand on
-You might bear it But we can't bear it,bear bear
About every other night.,other night
- He's in the kitchen.,kitchen in
"The first night , accordingly , we pushed to the house of a Maclaren in Strathire , a friend of Duncan 's , where we slept the twenty-first of the month , and whence we set forth again about the fall of night to make another easy stage .",push night
"Wait, wait, he's moving.",wait wait
What's in my hand?,hand in
He was in the bed!,bed in
"the other night?""",other night
little bear what's little bear learning .,bear bear
It it might be a help to him to have little local groups that  helped him out with these things.,help help
not in your mouth ?,mouth in
"Quick to jump into bed, quick to propose.",jump bed
"- Hi, Grandma.",hi grandma
what's in the box ?,box in
cookie cookie cookie cookie cookie .,cookie cookie
"Wait, wait.",wait wait
you wouldn't kick a ball in a museum .,kick ball
your mouth hurt .,hurt mouth
"Wait, wait.",wait wait
were safely in bed.,bed in
are you just too fast with those hands now ?,fast hand
in the sun ?,sun in
wait wait what did we do with socks this morning ?,wait sock
night night .,night night
in which hand .,hand in
But on the other hand if you,other hand
"Um, no, it's not in my head.",head in
wait wait wait wait .,wait wait
in the kitchen .,kitchen in
out of your head .,head out
He's hurt his hand.,hurt hand
here's some more milk ?,more milk
"Can I finish, can I finish?",finish finish
she is a big girl now .,big girl
Big Mouth.,big mouth
"Feeding my girls, making them happy.",feed girl
and a bear and a bear .,bear bear
in the box ?,box in
in the kitchen .,kitchen in
okay sing sing i have to read it .,sing sing
Are now boxed in by more and more spraying.,box more
These hands of mine are so soft.,soft hand
"Wait, wait...",wait wait
"it is only a cat! I can feed her no longer, and so I want to throw her",feed cat
Lights on!,light on
what's in the socks ?,sock in
"- Oh, it's over there on that dish.",dish on
"No, the girls will be on me.",girl on
"And the light is night above,",light night
aha and what's this on the bed .,bed on
"lights of the car, lighting up the distant, rising slopes of the",light light
"Oh wait, let's see what you gotta tell me today.",wait today
more balls .,more ball
The other girls aren't so lucky.,other girl
- will help with the big Push.,help push
I'm happy to help you if you're helping me.,help help
"`` Ball hurt his hand ; he howls at every thing , '' answered Jack scornfully .",hurt ball
"- Wait, wait.",wait wait
"- Wait, wait, wait, wait.",wait wait
"On the other hand,",other hand
"A boat load of lies, in those big beautiful eyes of yours.",big boat
jump jump jump jump jump jump ?,jump jump
more balls !,more ball
"No, wait, wait, wait.",wait wait
"Then she helped the girls carry the unconscious Prillie into the porch , where Barbara Shaw , in an agony of desire to be useful , poured a pailful of half frozen water over Prillie 's face and shoulders before anyone could stop her .",help girl
The TV's broken.,break tv
what's in this box ?,box in
She sings each night sitting in yonder tree.,sing night
"Whoever it is, girl, big butts are in.",big girl
It's in my head.,head in
don't hurt your tooth ?,hurt tooth
apples apples .,apple apple
Not like dogs and cats.,dog cat
♪ Moon lights up the night ♪,light moon
..a dog.. a dog that but today..,dog dog
"Wait, wait!",wait wait
I'm just a big ol' scurredy cat.,big cat
"- Hey, wait, wait, wait.",wait wait
In the dark?,dark in
is it in the box .,box in
my this is a big bed ?,big bed
what's in that box ?,box in
- But this is out of your hands.,hand out
"Like the other night, for instance.",other night
are you a big or a little dog .,big dog
Where's the other lighter?,other light
not on your hand .,hand on
"- Wait, wait.",wait wait
NowI'IIstuffyou with bread It don't hurt 'causeyou're dead,hurt bread
What's in my hand?,hand in
on your chair okay .,chair on
big sun .,big sun
"""How can a poor girl help the prince?"" asked they.",help girl
"You're a very pretty girl, Alex.",pretty girl
you finished eating would you like to get out of the chair .,finish chair
Hands that in other years,other hand
Big mouth?,big mouth
that don't hurt when you comb it um like you did last night .,hurt night
who's over there in the chair ?,chair in
the cat jumped out of the baby carriage ran over there and is hiding behind the tree .,jump cat
You are here today to help cooperating with our investigation.,help today
"Wait, wait wait.",wait wait
you finish this milk and i'll give you some more right away .,finish milk
the little girl jumps up and down three times !,jump girl
"Cat, jumping over dead person, 410;",jump cat
sometimes they do jump out of their boats .,jump boat
big dog ?,big dog
what's in this box ?,box in
"But you, on the other hand...",other hand
Well Nor you can't help me on this me old son,help me
"The other night, what ?",other night
Where are you headed in the dark of night?,head dark
